[
  {
    "id": "BUR1001",
    "code": "1 - AKÇALAR",
    "agencyId": "burulas",
    "shortName": "1 - AKÇALAR",
    "longName": "1 - AKÇALAR",
    "description": "1 - AKÇALAR",
    "color": "#f5c211",
    "carType": "bus"
  },
  {
    "id": "BUR1002",
    "code": "101",
    "agencyId": "burulas",
    "shortName": "101",
    "longName": "101",
    "description": "101",
    "color": "#f5c211",
    "carType": "bus"
  },
  {
    "id": "BUR1003",
    "code": "102",
    "agencyId": "burulas",
    "shortName": "102",
    "longName": "102",
    "description": "102",
    "color": "#f5c211",
    "carType": "bus"
  },
  {
    "id": "BUR1004",
    "code": "103",
    "agencyId": "burulas",
    "shortName": "103",
    "longName": "103",
    "description": "103",
    "color": "#f5c211",
    "carType": "bus"
  },
  {
    "id": "BUR1005",
    "code": "103A",
    "agencyId": "burulas",
    "shortName": "103A",
    "longName": "103A",
    "description": "103A",
    "color": "#f5c211",
    "carType": "bus"
  },
  {
    "id": "BUR1006",
    "code": "104",
    "agencyId": "burulas",
    "shortName": "104",
    "longName": "104",
    "description": "104",
    "color": "#f5c211",
    "carType": "bus"
  },
  {
    "id": "BUR1007",
    "code": "105",
    "agencyId": "burulas",
    "shortName": "105",
    "longName": "105",
    "description": "105",
    "color": "#f5c211",
    "carType": "bus"
  },
  {
    "id": "BUR1008",
    "code": "111A",
    "agencyId": "burulas",
    "shortName": "111A",
    "longName": "111A",
    "description": "111A",
    "color": "#f5c211",
    "carType": "bus"
  },
  {
    "id": "BUR1009",
    "code": "111B",
    "agencyId": "burulas",
    "shortName": "111B",
    "longName": "111B",
    "description": "111B",
    "color": "#f5c211",
    "carType": "bus"
  },
  {
    "id": "BUR1010",
    "code": "112",
    "agencyId": "burulas",
    "shortName": "112",
    "longName": "112",
    "description": "112",
    "color": "#f5c211",
    "carType": "bus"
  },
  {
    "id": "BUR1011",
    "code": "112A",
    "agencyId": "burulas",
    "shortName": "112A",
    "longName": "112A",
    "description": "112A",
    "color": "#f5c211",
    "carType": "bus"
  },
  {
    "id": "BUR1012",
    "code": "113",
    "agencyId": "burulas",
    "shortName": "113",
    "longName": "113",
    "description": "113",
    "color": "#f5c211",
    "carType": "bus"
  },
  {
    "id": "BUR1013",
    "code": "113A",
    "agencyId": "burulas",
    "shortName": "113A",
    "longName": "113A",
    "description": "113A",
    "color": "#f5c211",
    "carType": "bus"
  },
  {
    "id": "BUR1014",
    "code": "114",
    "agencyId": "burulas",
    "shortName": "114",
    "longName": "114",
    "description": "114",
    "color": "#f5c211",
    "carType": "bus"
  },
  {
    "id": "BUR1015",
    "code": "114A",
    "agencyId": "burulas",
    "shortName": "114A",
    "longName": "114A",
    "description": "114A",
    "color": "#f5c211",
    "carType": "bus"
  },
  {
    "id": "BUR1016",
    "code": "115",
    "agencyId": "burulas",
    "shortName": "115",
    "longName": "115",
    "description": "115",
    "color": "#f5c211",
    "carType": "bus"
  },
  {
    "id": "BUR1017",
    "code": "116",
    "agencyId": "burulas",
    "shortName": "116",
    "longName": "116",
    "description": "116",
    "color": "#f5c211",
    "carType": "bus"
  },
  {
    "id": "BUR1018",
    "code": "116C",
    "agencyId": "burulas",
    "shortName": "116C",
    "longName": "116C",
    "description": "116C",
    "color": "#f5c211",
    "carType": "bus"
  },
  {
    "id": "BUR1019",
    "code": "117",
    "agencyId": "burulas",
    "shortName": "117",
    "longName": "117",
    "description": "117",
    "color": "#f5c211",
    "carType": "bus"
  },
  {
    "id": "BUR1020",
    "code": "118A",
    "agencyId": "burulas",
    "shortName": "118A",
    "longName": "118A",
    "description": "118A",
    "color": "#f5c211",
    "carType": "bus"
  },
  {
    "id": "BUR1021",
    "code": "119",
    "agencyId": "burulas",
    "shortName": "119",
    "longName": "119",
    "description": "119",
    "color": "#f5c211",
    "carType": "bus"
  },
  {
    "id": "BUR1022",
    "code": "119A",
    "agencyId": "burulas",
    "shortName": "119A",
    "longName": "119A",
    "description": "119A",
    "color": "#f5c211",
    "carType": "bus"
  },
  {
    "id": "BUR1023",
    "code": "120",
    "agencyId": "burulas",
    "shortName": "120",
    "longName": "120",
    "description": "120",
    "color": "#f5c211",
    "carType": "bus"
  },
  {
    "id": "BUR1024",
    "code": "130",
    "agencyId": "burulas",
    "shortName": "130",
    "longName": "130",
    "description": "130",
    "color": "#f5c211",
    "carType": "bus"
  },
  {
    "id": "BUR1025",
    "code": "131",
    "agencyId": "burulas",
    "shortName": "131",
    "longName": "131",
    "description": "131",
    "color": "#f5c211",
    "carType": "bus"
  },
  {
    "id": "BUR1026",
    "code": "132",
    "agencyId": "burulas",
    "shortName": "132",
    "longName": "132",
    "description": "132",
    "color": "#f5c211",
    "carType": "bus"
  },
  {
    "id": "BUR1027",
    "code": "132İ",
    "agencyId": "burulas",
    "shortName": "132İ",
    "longName": "132İ",
    "description": "132İ",
    "color": "#f5c211",
    "carType": "bus"
  },
  {
    "id": "BUR1028",
    "code": "133",
    "agencyId": "burulas",
    "shortName": "133",
    "longName": "133",
    "description": "133",
    "color": "#f5c211",
    "carType": "bus"
  },
  {
    "id": "BUR1029",
    "code": "134",
    "agencyId": "burulas",
    "shortName": "134",
    "longName": "134",
    "description": "134",
    "color": "#f5c211",
    "carType": "bus"
  },
  {
    "id": "BUR1030",
    "code": "134F",
    "agencyId": "burulas",
    "shortName": "134F",
    "longName": "134F",
    "description": "134F",
    "color": "#f5c211",
    "carType": "bus"
  },
  {
    "id": "BUR1031",
    "code": "135",
    "agencyId": "burulas",
    "shortName": "135",
    "longName": "135",
    "description": "135",
    "color": "#f5c211",
    "carType": "bus"
  },
  {
    "id": "BUR1032",
    "code": "135H",
    "agencyId": "burulas",
    "shortName": "135H",
    "longName": "135H",
    "description": "135H",
    "color": "#f5c211",
    "carType": "bus"
  },
  {
    "id": "BUR1033",
    "code": "136",
    "agencyId": "burulas",
    "shortName": "136",
    "longName": "136",
    "description": "136",
    "color": "#f5c211",
    "carType": "bus"
  },
  {
    "id": "BUR1034",
    "code": "137",
    "agencyId": "burulas",
    "shortName": "137",
    "longName": "137",
    "description": "137",
    "color": "#f5c211",
    "carType": "bus"
  },
  {
    "id": "BUR1035",
    "code": "139",
    "agencyId": "burulas",
    "shortName": "139",
    "longName": "139",
    "description": "139",
    "color": "#f5c211",
    "carType": "bus"
  },
  {
    "id": "BUR1036",
    "code": "140",
    "agencyId": "burulas",
    "shortName": "140",
    "longName": "140",
    "description": "140",
    "color": "#f5c211",
    "carType": "bus"
  },
  {
    "id": "BUR1037",
    "code": "14F",
    "agencyId": "burulas",
    "shortName": "14F",
    "longName": "14F",
    "description": "14F",
    "color": "#f5c211",
    "carType": "bus"
  },
  {
    "id": "BUR1038",
    "code": "14L",
    "agencyId": "burulas",
    "shortName": "14L",
    "longName": "14L",
    "description": "14L",
    "color": "#f5c211",
    "carType": "bus"
  },
  {
    "id": "BUR1039",
    "code": "14L2",
    "agencyId": "burulas",
    "shortName": "14L2",
    "longName": "14L2",
    "description": "14L2",
    "color": "#f5c211",
    "carType": "bus"
  },
  {
    "id": "BUR1040",
    "code": "14L3",
    "agencyId": "burulas",
    "shortName": "14L3",
    "longName": "14L3",
    "description": "14L3",
    "color": "#f5c211",
    "carType": "bus"
  },
  {
    "id": "BUR1041",
    "code": "14N",
    "agencyId": "burulas",
    "shortName": "14N",
    "longName": "14N",
    "description": "14N",
    "color": "#f5c211",
    "carType": "bus"
  },
  {
    "id": "BUR1042",
    "code": "14U",
    "agencyId": "burulas",
    "shortName": "14U",
    "longName": "14U",
    "description": "14U",
    "color": "#f5c211",
    "carType": "bus"
  },
  {
    "id": "BUR1043",
    "code": "15",
    "agencyId": "burulas",
    "shortName": "15",
    "longName": "15",
    "description": "15",
    "color": "#f5c211",
    "carType": "bus"
  },
  {
    "id": "BUR1044",
    "code": "15A",
    "agencyId": "burulas",
    "shortName": "15A",
    "longName": "15A",
    "description": "15A",
    "color": "#f5c211",
    "carType": "bus"
  },
  {
    "id": "BUR1045",
    "code": "15B",
    "agencyId": "burulas",
    "shortName": "15B",
    "longName": "15B",
    "description": "15B",
    "color": "#f5c211",
    "carType": "bus"
  },
  {
    "id": "BUR1046",
    "code": "15H",
    "agencyId": "burulas",
    "shortName": "15H",
    "longName": "15H",
    "description": "15H",
    "color": "#f5c211",
    "carType": "bus"
  },
  {
    "id": "BUR1047",
    "code": "16A",
    "agencyId": "burulas",
    "shortName": "16A",
    "longName": "16A",
    "description": "16A",
    "color": "#f5c211",
    "carType": "bus"
  },
  {
    "id": "BUR1048",
    "code": "16S",
    "agencyId": "burulas",
    "shortName": "16S",
    "longName": "16S",
    "description": "16S",
    "color": "#f5c211",
    "carType": "bus"
  },
  {
    "id": "BUR1049",
    "code": "16İ",
    "agencyId": "burulas",
    "shortName": "16İ",
    "longName": "16İ",
    "description": "16İ",
    "color": "#f5c211",
    "carType": "bus"
  },
  {
    "id": "BUR1050",
    "code": "17A",
    "agencyId": "burulas",
    "shortName": "17A",
    "longName": "17A",
    "description": "17A",
    "color": "#f5c211",
    "carType": "bus"
  },
  {
    "id": "BUR1051",
    "code": "17B",
    "agencyId": "burulas",
    "shortName": "17B",
    "longName": "17B",
    "description": "17B",
    "color": "#f5c211",
    "carType": "bus"
  },
  {